{
  "contract": "hsclubs.summary",
  "version": 1,
  "schoolId": "sch_2Hn5Wq8ZcT1yE7uK4mB0",
  "slug": "bay-meadows",
  "schoolName": "Bay Meadows Demo School",
  "shortName": null,
  "address": null,
  "status": null,
  "clubCount": 0,
  "categories": {},
  "memberCount": 0,
  "lastUpdatedAt": null,
  "dataHash": null
}
